Johns Hopkins University / Lucidity,"alzheimers, biomedical research, data privacy, games, health tech, healthcare, research group",Not Live,Croatia,Andelo,"Web and mobile app ",React + Flutter,"Node.js + Next.js, TypeScript","We partnered with Johns Hopkins University Medical school (Kuchibhotla Lab) to combat Alzheimer’s disease. We helped doctors and scientists at JHU to design an application that allows Alzheimer’s patients to play “brain games” on a tablet or smartphone, all while bio-medical devices gather patients' biometrics. The web service compares the data from the patients biometrics in real time with the brain games results — to ultimately produce new Alzheimer’s data that is pivotal to finding a cure for this disease.  Due to the application’s success, JHU has received further funding from the University and has partnered with us to continuously add new features to the application over the next few years.","https://drive.google.com/file/d/13Fq3wbXILqDzuNVx6Vh9NgrG-SbTg0EI/view?usp=sharing, https://www.youtube.com/watch?v=aK05HCa-0LE",,,https://valerelabs.medium.com/combating-disease-through-innovation-and-mobile-app-design-5397151fc1b5,Yes,https://www.figma.com/file/Q71vt4FLQxl08T32a8ONDK/Lucidity-UI?node-id=1014%3A47657,,,,No,,,"Mental health care ",,https://www.figma.com/file/Q71vt4FLQxl08T32a8ONDK/Lucidity-UI?node-id=1014%3A47657,
Rootines,health tech,Live,Uruguay,Juan & Mavi,iOS & Android,Flutter,,"Rootines is a patient engagement platform for Pediatric Behavioral Health and Development Disorders that supports remote patient monitoring to improve care outcomes. Focused on data collection and identifying insights, Roootines connects care teams to faciliate patient reported outcomes. Rootines is built for use by parents, healthcare facilities, therapy offices, and other caregivers that support the health of individuals with chronic behavioral health conditions. ",,https://apps.apple.com/us/app/rootines-by-asd-ai/id1558391370,https://play.google.com/store/apps/details?id=app.rootines.android,https://www.rootines.app/,,,,,,No,,,,,,
Blue,"Fintech, data analysis, data tracking, investment analysis, stock market, stock trading",Not Live,Croatia,Patrik,"Website ","React ","Node.js + Next.js, Typescript","Blue is a cloud-based software for investment analysis meant to be used mainly by professional investors who are involved in stock trading. The main purpose of Blue is to create a tool that improves efficiency, usability, and cost of the existing offerings such as Bloomberg, FactSet, and Senteio. Blue will offer a very simple and easy-to-use web design that provides clean, high-quality data for its users. ",,,,,Yes,https://www.figma.com/file/znEIKTvZ8sU0q8u27cqv1p/Blue---UI?node-id=1%3A2,,,,No,,,Finance,,,
Groth,"Fintech, finance",Live,Croatia,Andelo Brzoja,Mobile app,Flutter,Node + Nest.js,"Fin-tech app to help users budget and plan their future for financial success.GROTH is like having a Personal Finance Advisor in your POCKET! Groth allows users to manage their cash flow all in one place and be able to see their previous, current, and future at a glance and easily create and achieve financial goals through customized solutions. ","https://www.youtube.com/watch?v=7FLSti935V4, https://drive.google.com/file/d/18vyXz6RdeSfBIUiT81676U33VJB9GIbD/view?usp=sharing, https://youtu.be/-SpZMQ-_-EQ",https://apps.apple.com/us/app/gr%C3%B4th-virtual-money-mentor/id1627286829,https://play.google.com/store/apps/details?id=com.grothapp.groth&pli=1,https://grothapp.com/,,https://www.figma.com/proto/XbpC0d8RR8MhJimg2LALGY/GrothApp?page-id=327%3A2&node-id=858-21262&viewport=360%2C48%2C0.11&scaling=scale-down&starting-point-node-id=858%3A18743&show-proto-sidebar=1,,,,No,Portfolio%20Log%20c69b905540664ebbafa04ab3d968184f/Valere_Labs_X_Groth.pdf,,Finance,,,
Groth,"Fintech, finance",Live,Croatia,Andelo & Patrik,"iOS + Android app ","Flutter ","Node.js + Next.js, TypeScript",Fin-tech app to help users budget and plan their future for financial success.,"https://www.youtube.com/watch?v=7FLSti935V4, https://drive.google.com/file/d/18vyXz6RdeSfBIUiT81676U33VJB9GIbD/view?usp=sharing, https://youtu.be/-SpZMQ-_-EQ",https://apps.apple.com/us/app/gr%C3%B4th-virtual-money-mentor/id1627286829,https://play.google.com/store/apps/details?id=com.grothapp.groth&pli=1,https://grothapp.com/,,https://www.figma.com/proto/XbpC0d8RR8MhJimg2LALGY/GrothApp?page-id=327%3A2&node-id=858-21262&viewport=360%2C48%2C0.11&scaling=scale-down&starting-point-node-id=858%3A18743&show-proto-sidebar=1,,,,No,Portfolio%20Log%20c69b905540664ebbafa04ab3d968184f/Valere_Labs_X_Groth%201.pdf,,Finance,,,
Moon Invest,Fintech,Not Live,Croatia,Andelo,"iOS + Andorid app ","Flutter ",Node.js + Next.js,"MoonApp is a tool for making infomed investments decisions with trusted friends (Crew members). MoonApp helps aspiring expert investors bridge the gap between investment hype and fundamentals and develop the mental acuity and fortitude required to naviagte volatile markets. ",https://youtu.be/hqeJnuT09wk,,,https://www.investwithmoon.com/,Yes,https://www.figma.com/file/UZo2JFdnL85hQv4Ojd73Ij/Moon-MVP?node-id=165%3A4,,,,No,,,Finance,,,
Penny Finance,"Education, Fintech, Software Development, finance, financial advisor",Live,India,,website,,,"Penny finance is the first personalized and tech-powered financial mentor for women who don’t have access to a financial advisor  and crave easy, digestible financial education and know-how to increase cash flow today, and retire with wealth tomorrow.",,,,https://www.penny-finance.com/?gclid=CjwKCAjwvdajBhBEEiwAeMh1U4-ehq0G8o09lMLrgZ0AOBMNXrzFp8Pe1q3A3wxRv2MgMGwlT3Ef0RoCjEUQAvD_BwE,,,,,,No,,,,,,
ARX (poor relationship),"Fintech, SaaS, banking, finance",Not Live,India,,,,,Saas software for banks,,,,,,,,,,No,,,,,,
Blue,"Bloomberg, Fintech, stock market, stock trading",Not Live,Croatia,,,,,Bloomberg terminal clone but it is on the stock side of things. It is still under development.,,,,,,https://www.figma.com/proto/znEIKTvZ8sU0q8u27cqv1p/Blue---UI?node-id=364-3459&scaling=min-zoom&page-id=1%3A2&starting-point-node-id=364%3A3459,,,,No,,,,,https://www.figma.com/proto/znEIKTvZ8sU0q8u27cqv1p/Blue---UI?node-id=364-3459&scaling=min-zoom&page-id=1%3A2&starting-point-node-id=364%3A3459,
"Chivas Regal- Old Trafford Manchester United ","AR/VR, immersive experience, soccer",Live,Peru,Carlos,,,,"a 360 immersive advertising experience at the point of sale where users are presented with a 3D visit to Manchester United's Old Trafford stadium. There, they are informed that through the purchase of their product they will be entered into a raffle to win a meet and greet with one of their favorite players.",,,,https://youtu.be/EeT154GU5GM,,,,,,No,,,,,,
Sodimac Peru- 3D Refridgerators,"Ecommerce, immersive experience, virtual platform",Live,Peru,Carlos,,,,"Immersive experience where users can choose a refrigerator among different brands and models to view it in a 3D environment and at the same time interact with it by opening and closing the compartments, visualizing the interior space and seeing the characteristics of every one of them.",,,,https://youtu.be/gOU8lAlrqfg,,,,,,No,,,,,,
"Collegefair ","Education, Education web portal, b2b, b2c, chat features, data sharing, marketing capabilities, marketplace, personalized accounts, record keeping, recruiting platform, recruitment, scalable platform",Live,India,Saurabh Acharya,Website,Laravel,Laravel,"College Fairs USA is a scalable web application that connects high school students and schools through virtual college fairs. It provides recruiters a chance to connect with and recruit top prospective students through private one-on-one chats and group discussions. They can share event reporting and data on all students, including transcripts of discussions that were had. Schools are able to showcase their college/university through fully branded and customized booth, including displays for digital content, brochures, personalized account support, and more. 
 ","https://www.youtube.com/watch?v=LN7kIV8zt9w, https://d2c3hglki5wb5z.cloudfront.net/assets/projects/Transparent_Render_College_Fair_New_1.webm, https://drive.google.com/file/d/1TvVe8GjoaWDIQpQSW95cyypwNaoF4Tr0/view?usp=sharing, https://drive.google.com/file/d/1W_l4g_tlAPH2PfCB3llwrykPMWk1j5KS/view",NA,NA,http://virtualcollegefairsusa.com/,Yes,https://www.figma.com/file/qJjtfxO7mrD702ocAlZKzw/CollegeFair?node-id=258%3A6194,,,Yes,Yes,,Posted,education,,,
Crypto Homes,"Real Estate, blockchain, buy and sale, crypto, marketplace",Live,India,Samreen,Website,React,Laravel,Buy and sell homes using Cryptocurrency,,,,https://cryptohomes.com,,Designs to be shared by Samreen,,,,No,,,blockchain/web3,,,
Current Real Estate- 3D apartments App,"3D, Real Estate",Live,Peru,Carlos,,,,"Mobile application to visualize apartments, get a 3D view of the property, access the photo gallery, 360 view of the property, view location map, access commercial videos, directly contact a realtor/brokerage, get directions to the property through Waze, and try out a variety of configurations for real estate spaces.",,,,https://www.youtube.com/watch?v=rqZ_Lnv3n7c,,,,,,No,,,,,,
Home Appraisal,"Real Estate, hiring platform, subcontractors",Live,,,iOS & Android,Flutter 3.0.2,Codeigniter (3),"BPO Xpress contracts photography out to local drivers. Use your cell phone, your car, and few minutes of your spare time to make as much as $70/hr completing exterior photography on vacant homes, investment properties, and apartment buildings from the exterior for banks, insurance companies, and other institutional investors.",,https://apps.apple.com/us/app/home-appraisal/id1643929698,https://play.google.com/store/apps/details?id=com.homeappraisal,,,,,,,No,,,,,,
Inmobility,Real Estate,Not Live,Uruguay,Juan & Mavi,iOS & Android,Flutter,Ruby on Rails,"We are currently building a mobile & web platform that centralizes all building management related tasks in one place. It makes both administrators and occupant's lives easier by automating long and boring manager's tasks, and also handling payments and inquiries. . ",,,,,,,,,,No,,,,,,
Kova Environment Configurator,Real Estate,Live,Peru,Carlos,,,,"3D web platform where users can change kitchen and bathroom environments with products offered by the brand such as floors, cabinets, quartz, etc. After choosing the products, a form is sent where the supplier receives the information selected by the client to generate a quote and start a conversation.",,,,https://youtu.be/Ia_9J4TWAfY,,,,,,No,,,,,,
LavaMap,"Real Estate, data analysis, data tracking, database",Not Live,India,,,,,"We augmented LavaMaps existing team to help them get their development project off the ground and thriving.  They Provide NYC real estate professionals with the best tools and data to buy, sell and close deals.",,,,https://lavamap.com/,,,,,,No,,,,,,
Reasy Market,"Real Estate, consumer products and services, marketing capabilities",Live,India,,website,AngularJS,Laravel,"Marketing tools for real estate agents. They provide quality content that's current, fresh and relevant for social media and/or farming.
They have a vast supply of Canva templates for users to choose from.",,,,https://reasymarket.com/,,,,,,No,,,,,,
Lucky Monks,"crypto, nft",Not Live,Croatia,,,,,"We helped Lucky Monks create their custom NFT minting site in record speed. We created this site so it could be built upon, just like the NFT upgradeable smart contracts involved. This allows for more flexibility in the future for utility NFTs.",,,,https://lucky-monks-fe.herokuapp.com/,Yes,https://xd.adobe.com/view/7e08b4a6-65ce-4da3-881a-1f27fbaf1551-2b5b/,,,,No,,,Crypto/NFT,,,
Mintable,"crypto, nft",Live,,,,,,"We helped Mintable create one of the first open-sea-esq platforms where you can mint your own NFTs, track important stats in the blockchain world, and even sign up for their DAO.",,,,https://mintable.app/,,,,,,No,,,,,,
Vale Unleashed NFT app,"crypto, games, nft",Not Live,Croatia,Andelo,website,"React ",Node.js,Vale Unleashed is an NFT fantasy game in which players play-to-earn PVP/PVE by participating in battles with their Vale Unleashed NFT characters. Players received various types of rewards depending on the game type. You can buy a Vale NFT today to play the game!,https://youtu.be/7u_v0v6SJK4,,,"https://valeunleashed.com ",Yes,https://www.figma.com/file/kDqWApJGc4HkJv7Jc3lwaU/BFTE---NFT?node-id=0-1,,,,No,,,Gambling,,,
Curated Logistics,"Ecommerce, booking, network, payment, service provider, subcontractors",Not Live,India,Samreen,iOS & Android,React Native,Laravel,,,https://apps.apple.com/in/app/curated-logistics/id1601629160,https://play.google.com/store/apps/details?id=com.reduxproject,,,,,,Yes,No,,,ecommerce,,,
HP Peru- Vital Ecommerce,"Ecommerce, marketing, virtual platform",Live,Peru,Carlos,,,,"is 360° virtual experience where customers can view 3D products such as tablets, laptops and printers, view features and interact with them",,,,https://www.youtube.com/watch?v=2Dj5d2LXhjc,,,,,,No,,,,,,
Plantalier (Tuilly),"Ecommerce, cms, feeds, marketplace, third party shipping platform",Live,India,Samreen,Web app,Bootstrap,Laravel,"Tuilly is a marketplace where plant lovers can learn,  engage, and transact with each other. Their users are able to buy and sell plants and plant related accessories, vote for and submit pictures to win prizes, learn through their blog posts, and receive reminder notifications for plant care.",,http://3.143.238.159/ (WIP),,https://www.tuilly.com/,,,,,,No,,,ecommerce,,,
Saga Falabella- Ecommerce AR,Ecommerce,Live,,,,,,"an ecommerce platform that allows its users to view 3D furniture. The selected product can rotate in all directions. You can zoom in to see details of the fabric or leather, change the color of the tapestry and finally through augmented reality, view the furniture in the customer's own environment.",,,,"https://www.youtube.com/watch?v=n8BTqnnBM1E ",,,,,,No,,,,,,
Givvem 🔸,"Ecommerce, giftcard",Live,India,,iOS / Android,,,"Gifting is made easy with Givvem.
Making digital gift-giving a socially, driven interaction.",,,,https://givvem.com/,,,,,,No,,,,,,
123 Stickers,"Ecommerce, redesign, retail, revamp, stickers",Live Soon,Uruguay,Juan & Mavi,web,,,This project is a complete redesign of 123Stickers. We are modernizing their website and enhancing user experience to elevate their online presence and streamline customer interactions.,https://stickers-123-user-website.web.app/#/,,,https://www.123stickers.com/,,,,,,No,,,,,,
Dwell Optimal,"Airbnb-like, Hosting, Real Estate, b2b, booking, corporate, leasing, map feature, properties, travel",Live,Croatia,Antonio,App,,,"DwellOptimal provides an alternative to the hotel experience by providing secure real estate solutions for corporate extended-stay travel. We helped them create an integrated software platform for managing utilization, controlling unit environments remotely and allowing employees to tailor elements of their live|work spaces.

Since launching, they are in the final stages of securing a round of funding while simultaneously working with us on their V2. ",,,,https://www.dwelloptimal.com/#/,,,,,,No,,,,,,
HP- Peru3D Products App,3D,Live,Peru,Carlos,,,,"Mobile app to view and interact with realistic 3D models of HP brand products such as Laptops, PCs and Printers.",,,,https://youtu.be/2Dj5d2LXhjc,,,,,,No,,,,,,
DealIXu,"community based platform, groceries / essential prodcuts, inventory management, social",Not Live,Uruguay,Juan & Mavi,iOS & Android,Flutter,Ruby on Rails,"DealIXu is an app that will help you find groceries and other essential products in nearby stores. You can also update product availability using easy upvote/downvote buttons in the app. This will help your fellow community members, neighbors and seniors easily find their day to day essentials.",,,https://play.google.com/store/apps/details?id=com.agasti.dealxu&hl=en_US&gl=US,,,,,,,No,,,,,,
Athes,"GPS/ geolocation, artificial intelligence, athletes, coach, curated content, data tracking, learning platform, marketplace, membership management , recruitment, social, sports, video analysis, virtual learning",Live,Croatia,Andelo,App,,,,"https://youtube.com/shorts/obXfvmaYrBI, https://www.youtube.com/watch?v=5RfhG9ih6JQ",https://apps.apple.com/us/app/athesai/id6451111993,https://play.google.com/store/apps/details?id=com.athes&pli=1,https://athes.io/,Yes,https://www.figma.com/file/p8leqPGLwiMRoXz6YPKLJW/New-AthesV2--V1.0?type=design&node-id=0%3A1&mode=design&t=q1dxYmAlDZNx29YK-1,,,,No,,,,https://docs.google.com/spreadsheets/d/1bKfIxXNXlljafc6f-BtmFyEc0nxlWT96G5LiZOR9Io0/edit#gid=968258116,,
Elete,"Ecommerce, artificial intelligence, augmented reality, basketball, computer vision, consumer products and services, gamification, machine learning, skill building software, sports",Live,India,Kajal,iOS Native & Website,Swift,Laravel,"Elete is the most addictive and advanced app to develop ball handling skills. Through Computer Vision, Machine Learning, and a gamification format, its users are able to acquire basketball dribbling skills and moves. It uses Augmented Reality & Apples ML Core 60+ ",https://www.youtube.com/watch?v=bYAAtegK3wE,https://apps.apple.com/us/app/elete-dribble/id1454189239?ls=1,,https://eletebasketball.com/,,,,,,Yes,,Posted,sports,,,
Flite Golf🔺,sports,Live,India,"Manish ",iOS + Web,,,"Flite Golf is a leader in modern and engaging golf
technology. Back9 app offers a proven, integrated, full-stack technology suite to operate a golf entertainment venue. Valere has been augmenting their in-house development team on their mobile and web products.

",,,,https://www.flitegolf.com/,,,,,,Yes,,,,,,
Playbook 2 devs retainer,"chat features, communication, social, sports",Live,,,,,,,,,,,,,,,,No,,,,,,
playbook connect,"chat features, communication, social, sports",Live,,Retainer,React Native,Python,DJango,"Playbook is a mobile app to communicate with all members of a team. Whether they are parents, players, all members from the organization have  the ability to chat. Playbook will allow all members of your organization the ability to chat! Whether you are a parent, player, or a coach — this is the ideal mobile app to communicate with all members of your team.",,https://apps.apple.com/us/app/playbook-connect/id1576212178,,,,,,,,No,,,,,,
Align,"athletes, social media, sports",Not Live,India,,iOS Native,,,"Aligns helps athletes get discovered. Users could monetize their likeness. ",,,,,,,,,,No,,,,,,
Practice with Pros,"Simulation software, coach, photo and video sharing, sports, website",Not Live,India,,web + Mobile,React,,"Practice with Pros was aquired. Their marketplace product connected baseball amateurs to baseball pros! We had integrated video uploading features, a content management system.. It was founded by MLB vets Scott Van Slyke & Shawn Tolleson",,,,,,,,,,No,,,,,,
Asesso Health🔺,"artificial intelligence, computer vision, dental, health tool, healthcare",Not Live,India,,,,,Valere helped design and build an application that allows users to scan their teeth with precise accuracy and then offer products or services relevant to the patient such as mouthguards and braces.,,,,,,,,,,No,,,,,,
PoachAI,"SaaS, data scraping, machine learning, recruiting platform, recruitment, sentiment score, top talent",Not Live,,Anmol,website,"Angular ",Node.js,"A web platform for recruiters to discovery ""sentiment scores"" that convey how employees feel being at their company. Used by recruiters to poach employees from companies. Uses AI that scrapes data from the web. ",,,,rapin,,,,,Yes,No,,Posted,SaaS,,,
FantasyWolf,"Ecommerce, advertise, crowdsource, fantasy sports, leagues, marketplace",Live,India,Saurabh Acharya,,Bootstrap,Laravel,"The only web marketplace where fantasy sports fans can buy and sell their fantasy sports teams at any time.  Its users have the opportunity to profit from their sales, crowdsource to make a run in fantasy sports competitions, advertise, buy and manage their teams.
",,NA,NA,https://thefantasywolf.com/,NA,,,,,No,,,"ecommerce
Fantasy sports",,,
Huddle,"fantasy sports, football",Not Live,VD,,,,,,,,,,,,,,,No,,,,,,
Fantasy World,"Education, Real Estate, Simulation software, avatar, gamification, virtual learning, virtual platform",Not Live,India,DD,iOS Application,Swift,Codeigniter,"Fantasy World uses simulation software to engage its users in real-world situations through a real estate lens.  In this virtual world users have to balance their job, pay weekly bills, and keep up with their property(ies). ",,https://apps.apple.com/us/app/pi-fantasy-world/id1564396926,,,,https://www.figma.com/proto/MRUIW1CXGTiuKpQgmZYOFm/Fantasy-World?node-id=46%3A1137&scaling=min-zoom,,,Yes,No,,,Gaming,,,
Maestro Peru- Maestra House,virtual platform,Live,Peru,Carlos,,,,"a 360 immersive experience where users can visualize a 3D-type apartment and, in turn, through an interactive menu, be able to visualize all the construction layers (electrical connections, drainage water connections, foundations, columns, flats, etc) and raise awareness about the proper construction of a home.",,,,https://youtu.be/_lLwGeFLHUc,,,,,,No,,,,,,
FlyVirga,"Navigation, Real-time reporting, chat features, graphical interface, tracking capabilities",Live,India,,iOS Native,Swift,Node.JS,"We helped FlyVirga create an app for pilots to submit real-time PIREPs for flight planning, management, and safety. Virga is aviation’s only app that allows pilots to submit PIREPs without the need for ATC or the radio.It’s used by the NAFI (National Association of Flight Instructors), and it is recognized by FAA (Federal Aviation Administration) as “The Official App to Submit PIREP Reports”.
",https://drive.google.com/file/d/1ZbTaxt8QxErUDRcgTRVQrDS-qowwZ3to/view?usp=sharing,https://apps.apple.com/ca/app/fly-virga/id1524210560,,,,,,,Yes,Yes,,Posted,aviation,,,
Foodid,"Education web portal, consumer products and services, database, food",Live,India,DD,iOS & Android Hybrid App Development,React Native,Codeigniter,"FoodID scans and searches packaged goods to identify whether or not it contains ingredients its user is trying to avoid due to allergies, intolerances, dietary restrictions, or preference. Food ID works through the use of an API called Chomp. The API provides information on products and what’s in them through the product’s barcode. They have a robust database that is primarily built through user-generated content. Additionally, users are able to use their food journal to track the effects of certain food items. ",,https://apps.apple.com/us/app/food-id/id1563342559,,https://www.foodid.biz/,,https://www.figma.com/file/415HwgAT9xj9g37txw0Ktj/FOOD_ID_FOR_DEV?node-id=0%3A1,,,Yes,No,,,food,,,
Keto 🔺,"barcode scanning capabilities, consumer products and services, data scraping, food, health and wellness, health tool",Live,India,DD,hybrid,"Flutter	 ",Laravel,This Keto app deals with over 850k database of food items,"https://youtu.be/ECwYSlbWBFs, https://drive.google.com/file/d/1LEN7B89I2hyRZaBXduWu0BkeZIj9yS0d/view",https://apps.apple.com/in/app/is-it-really-keto/id6444953138,,,,,,,,No,,,,,,
Paleo Ranch,"food, website",Live,Peru,Carlos,web,,,https://apps.apple.com/in/app/is-it-really-keto/id6444953138https://apps.apple.com/in/app/is-it-really-keto/id6444953138,,,,www.paleoranch.com,,,,,,No,,,,,,
Pop Bitties,"food, website",Not Live,Peru,Carlos,web,,,"We built Pop Bitties’ e-commerce website. It was just over 20 years ago that a passion for cooking and commitment to a healthy lifestyle inspired Mark Andrews to start a healthy pita bread sandwich cart. The cart became so popular that he decided to develop some delicious baked pita chips for customers to enjoy while waiting in the long lines. That’s how he created his first snacks, Stacy’s Pita Chips. That’s where we came in to help launch his business to the next level. ",,,,https://popbitties.com/,,,,,,No,,,,,,
Ford Argentina- Car Dealer,"3D, Ecommerce, cars, custom build",Live,Peru,Carlos,,,,"Immersive sales tool to help potential buyers visualize their chosen 3D car, showing the different characteristics and details of the bodywork and real interior view.",,,,"https://www.youtube.com/watch?v=ay-soK4mAUg ",,,,,,No,,,,,,
"Pitch ","community based platform, curated content, linked-in like, personalized matches, professional network, social media",Live,India,Samreen,iOS,React Native,Laravel,"Pitch is a professional networking community that thrives on authenticity, transparency, social connections, and fun. With Pitch, you can tell your professional story wherever you are in your journey, whether just getting started or looking to build your next team. By simply answering questions and sharing media, you can tell a unique story, connect with people you actually want to meet, and discover the coworkers and insights that lead to opportunities.

",,https://apps.apple.com/in/app/pitch-network-photo-resume/id1562945398,,https://www.pitch-app.com/,,,,,Yes,No,,,social networking,,,
Gamestock,"gambling, gaming, sports betting, stock market, stock trading",Not Live,India,Anmol,iOS Native,Swift,,"Sports betting app, similar to the stock market. It’s not live but we have figma files we could showcase through a screenshare",,,,,,,,,,No,,,sports,,,
UDDA🔺,"gambling, sports betting",Not Live,India,,,,,"UDDA is a leading and legally available sports betting solution (Mobile application and web portal). This social free-to-play sports betting app allows users to place bets on various sporting events like basketball, football, golf, hockey, etc., and win prizes. The application possesses all the features a sports betting solution must have and gives the users the thrill of betting on a live game via in-app gaming currency and soon with real dollars.",,,,,,,sports data api,,,No,,,,,,
